{
	"format": "textmode.document",
	"formatVersion": "3.0.0",
	"metadata": {
		"createdAt": "2026-08-28T12:00:00.000Z",
		"generator": {
			"name": "textmode.export.js",
			"version": "1.8.1"
		}
	},
	"layers": [
		{
			"visible": true,
			"opacity": 1,
			"blendMode": "normal",
			"offsetX": 0,
			"offsetY": 0,
			"rotationZ": 0,
			"grid": {
				"cols": 2,
				"rows": 2,
				"cellWidth": 8,
				"cellHeight": 8
			},
			"id": "base",
			"cells": {
				"encoding": "object-rows-v1",
				"rows": [
					[
						{
							"x": 0,
							"y": 0,
							"character": "A",
							"foreground": "#ff0000ff",
							"background": "#000000ff",
							"transform": {
								"invert": false,
								"flipX": false,
								"flipY": false,
								"rotation": 0
							}
						},
						{
							"x": 1,
							"y": 0,
							"character": "😀",
							"foreground": {
								"r": 0,
								"g": 255,
								"b": 0,
								"a": 255
							},
							"background": {
								"r": 0,
								"g": 0,
								"b": 255,
								"a": 128
							},
							"transform": {
								"invert": false,
								"flipX": true,
								"flipY": false,
								"rotation": 360
							}
						}
					],
					[
						{
							"x": 0,
							"y": 1,
							"character": " ",
							"foreground": "#00000000",
							"background": "#123456ff",
							"transform": {
								"invert": false,
								"flipX": false,
								"flipY": true,
								"rotation": 90
							}
						},
						{
							"x": 1,
							"y": 1,
							"character": "X",
							"foreground": "#00000000",
							"background": "#00000000",
							"transform": {
								"invert": false,
								"flipX": false,
								"flipY": false,
								"rotation": 0
							}
						}
					]
				]
			}
		}
	]
}
